Código,Descripción del producto,Valor exportado en 2002,Valor exportado en 2003,Valor exportado en 2004,Valor exportado en 2005,Valor exportado en 2006,Valor exportado en 2007,Valor exportado en 2008,Valor exportado en 2009,Valor exportado en 2010,Valor exportado en 2011,Valor exportado en 2012,Valor exportado en 2013,Valor exportado en 2014,Valor exportado en 2015,Valor exportado en 2016,Valor exportado en 2017,Valor exportado en 2018,Valor exportado en 2019,Valor exportado en 2020,Valor exportado en 2021
400819,Varillas y perfiles; de caucho celular,107,104,118,309,558,971,696,534,673,1179,1286,1564,907,1457,787,999,875,577,437,630
290511,"""Metanol """"alcohol metílico""""""",3,11,3,48,0,3,39,2,1,32,195,2012,83,117,0,0,0,79,1945,627
520420,Hilo de coser de algodón; acondicionado para la venta al por menor,584,668,951,1364,1491,1786,1991,1565,1887,1917,1772,2277,1315,1384,1392,1039,987,757,450,626
600240,"""Tejidos de punto; de anchura <= 30 cm; con un contenido de hilados de elastómeros >= 5% en ...",379,465,729,618,452,435,403,762,726,1135,994,809,708,525,481,443,414,326,304,625
840790,"""Motores de émbolo """"pistón"""" alternativo de encendido por chispa y motores rotativos; de encendido ...",578,1208,10918,71564,62025,34348,9548,10169,5364,4178,1044,4114,882,418,639,818,1085,693,681,624
560410,Hilos y cuerdas de caucho; revestidos de textiles,230,169,286,542,642,719,725,781,1115,986,837,794,849,578,401,503,553,333,323,624
731450,"""Chapas y tiras; extendidas """"desplegadas""""; de hierro o acero""",1081,2001,159,206,183,177,131,351,484,504,526,328,460,592,632,760,840,627,564,623
381210,Aceleradores de vulcanización preparados,152,330,730,1020,463,314,844,545,520,632,807,896,599,579,193,121,211,342,349,621
401310,"""Cámaras de caucho para neumáticos """"llantas neumáticas""""""",4403,7161,6753,7910,8111,7657,7851,5777,5953,6189,4189,2768,2948,1921,1951,1356,954,509,363,616
847940,Máquinas de cordelería o cablería (exc. máquinas para retorcer de los tipos utilizados en hilatura),490,979,257,1645,1457,214,4143,850,543,6787,1040,490,476,1409,2542,3882,151,1879,423,615
680610,Lana de escoria; de roca y lanas minerales simil.; incl. mezcladas entre sí; en masa; hojas ...,925,851,1067,1475,1710,1044,1914,1262,1142,1424,2029,1315,2863,1846,1245,1071,431,812,355,615
890510,Dragas,12,0,370,841,35,27399,250,0,256,11,44,40,0,40172,2884,50,15107,33623,1000,614
320413,Colorantes básicos sintéticos orgánicos; preparaciones a base de colorantes básicos sintéticos ...,388,352,379,412,475,476,533,540,527,905,295,207,448,312,623,338,547,770,738,611
293629,Vitaminas y sus derivados utilizados principalmente como vitaminas; sin mezclar (exc. vitaminas ...,431,138,104,68,402,224,204,108,48,218,762,293,355,69,172,720,544,469,239,611
021019,"""Carne de porcinos; salada o en salmuera; seca o ahumada (exc. piernas; paletas; y sus trozos; ...",367,943,2169,2256,2532,2556,1365,833,649,1081,2288,908,323,412,874,3060,940,470,517,608
390140,copolímeros de etileno-alfa-olefinas; que tienen una gravedad específica de <0;94; en formas ...,0,0,0,0,0,0,0,0,0,0,0,0,0,0,0,59,1686,518,169,605
940520,Lámparas eléctricas de cabecera; mesa; oficina o de pie,88,315,291,447,387,300,378,304,816,443,403,266,399,365,328,295,288,315,264,605
300320,Medicamentos; que contengan antibióticos; sin dosificar ni acondicionar para la venta al por ...,1435,2671,1995,401,1715,4035,5913,5433,6312,3798,5265,6200,4827,4071,2846,3007,2155,670,884,604
310430,Sulfato de potasio (exc. en tabletas o formas simil. o en envases de un peso bruto <= 10 kg),6,8,0,0,1,65,617,531,741,1362,777,1149,1236,711,1008,1262,957,689,292,604
320641,Ultramar y sus preparaciones; del tipo de las usadas para colorear cualquier materia o como ...,7,18,44,20,34,93,88,17,42,54,56,126,134,133,157,175,342,321,435,604
610690,"""Camisas; blusas y blusas camiseras; de punto; de materia textil; para mujeres o niñas (exc. ...",165,567,705,990,605,597,380,433,708,1417,870,1099,764,644,666,743,489,766,416,603
854330,Máquinas y aparatos electricos de galvanotecnia; electrólisis o electroforesis,829,1840,1708,1878,2233,1494,3753,8969,764,509,939,304,5381,4679,1794,6535,4092,1571,4403,603
320730,"""Abrillantadores """"lustres"""" líquidos y preparaciones simil.; del tipo de las usadas en cerámica; ...",0,0,3,4,4,11,5,1,6,2,38,480,169,1247,2176,2528,2614,730,309,602
521139,Tejidos de algodón; con un alto contenido de algodón; pero < 85% en peso; mezclado exclusiva ...,348,699,968,1410,1170,1123,902,589,441,575,509,659,976,806,923,893,1038,1187,445,602
021012,"""Tocino entreverado de panza """"panceta"""" y sus trozos; de porcinos; salados o en salmuera; ...",93,282,237,32,148,26,90,292,18,34,25,10,8,5,0,3,100,289,428,600
070320,Ajos frescos o refrigerados,218,23,25,660,803,817,928,132,1,459,2,2,12,3,5,72,109,253,2099,600
903110,Máquinas para equilibrar piezas mecánicas,35,199,375,412,509,451,728,206,753,680,346,293,575,303,258,427,595,192,295,600
291419,"""Cetonas acíclicas sin otras funciones oxigenadas (exc. acetona; butanona """"metiletilcetona"""" ...",98,112,80,118,93,1282,445,607,283,106,95,47,78,51,50,292,398,580,586,599
560811,Redes de mallas anudadas; confeccionadas para la pesca; de materia textil sintética o artificial ...,1082,784,626,792,761,1025,711,447,1431,359,396,375,359,319,332,313,398,373,259,597
611030,"""Suéteres """"jerseys""""; """"pullovers""""; cardiganes; chalecos y artículos simil.; de punto; de ...",790,593,1317,1332,1031,888,448,348,451,733,575,452,677,642,395,500,797,1109,470,596
382312,Ácido oleico; industrial,811,1110,1651,2813,711,607,968,2325,2670,3771,5726,5307,2233,1424,1828,2290,807,119,164,595
854160,Cristales piezoeléctricos montados,5161,1734,1650,1884,1298,622,455,891,1792,1845,1206,795,789,1519,588,1176,492,494,911,594
844120,"""Máquinas para la fabricación de sacos; bolsas """"bolsas"""" o sobres; de pasta de papel; de papel ...",651,185,1079,451,422,1350,562,602,671,505,388,706,1359,1043,1989,969,414,2754,1058,593
843142,"""Hojas de topadoras frontales """"bulldozers"""" o de topadoras angulares """"angledozers""""; n.c.o.p.""",2526,2745,4133,4625,5134,6128,6777,4837,4577,3706,837,451,729,542,756,438,653,435,483,593
848710,Hélices para barcos y sus paletas,0,0,0,0,0,514,725,406,205,129,80,193,360,679,582,482,270,230,220,590
920600,Instrumentos musicales de percusión (por ejemplo: tambores; cajas; xilófonos; platillos; castañuelas; ...,795,1250,1225,2178,2522,2904,2515,1737,1530,1492,1106,1445,1631,944,936,982,896,847,575,590
850780,Acumuladores eléctricos (exc. ​​Acumuladores usados ​​y acumuladores de plomo-ácido; níquel-cadmio; ...,2831,3205,5528,9580,17613,12336,5612,10289,8609,11045,1281,490,484,64,467,381,1021,3551,2942,587
870710,Carrocerías de automóviles de turismo,2232,3538,816,2110,970,987,1088,520,278,239,245,771,868,499,483,103,1282,2481,660,585
843241,esparcidores de estiércol (excl. pulverizadores),0,0,0,0,0,0,0,0,0,0,0,0,0,0,0,677,426,340,673,582
820600,Herramientas de dos o más de las partidas 8202 a 8205; acondicionadas en juegos para la venta ...,819,44,156,244,149,152,255,369,384,422,972,867,598,632,551,442,351,402,681,582
420231,"""Billeteras; portamonedas; llaveros; petacas; pitilleras; bolsas para tabaco y demás artículos ...",155,216,271,469,568,902,793,729,858,946,789,956,1402,938,1276,805,696,534,660,581
520859,Tejidos de algodón; con un contenido de algodón >= 85% en peso; de peso <= 200 g/m²,150,366,610,783,729,1530,2069,2149,1568,1271,883,995,876,706,705,610,577,389,394,581
520829,Tejidos de algodón; con un contenido de algodón >= 85% en peso; de peso <= 200 g/m²; blanqueados ...,580,1028,1923,2007,2528,2517,2204,1719,2101,1768,1253,1191,1007,758,703,676,547,718,376,581
761100,Depósitos; cisternas; cubas y recipientes similares para cualquier materia (excepto gas comprimido ...,26,0,40,5,412,6,2,1373,101,0,2,1,0,8,696,967,640,37,306,581
121293,Caña de azúcar; fresca; refrigerada; congelada o seca; incl. pulverizada,0,0,0,0,0,0,0,0,0,0,0,0,0,0,3,3,1,6,4,579
511219,Tejidos de lana peinada o pelo fino peinado; con un contenido de lana o pelo fino >= 85% y ...,379,501,479,2360,2630,2768,1306,448,577,840,761,684,624,672,504,490,457,682,389,579
741012,Hojas y tiras delgadas; de aleaciones de cobre; sin soporte; de espesor <= 0;15 mm (exc. hojas ...,15,7,2,0,51,93,53,26,12,28,15,22,85,82,71,172,80,279,574,578
080111,Cocos; secos,84,154,223,406,258,337,359,381,291,423,647,793,458,158,204,159,212,414,358,577
521120,Tejidos de algodón; con un alto contenido de algodón; pero < 85% en peso; mezclado exclusiva ...,0,0,0,0,0,497,2414,682,1867,3845,962,811,592,837,253,242,553,1001,253,575
391890,Revestimientos para suelos; incl. autoadhesivos; en rollos o losetas y revestimientos para ...,103,230,105,110,175,317,377,317,287,764,973,912,588,653,582,709,896,862,519,574
401695,Colchones; almohadas; cojines y demás artículos inflables; de caucho vulcanizado sin endurecer ...,1271,1260,1978,2169,3133,1082,1603,1108,1083,1354,1394,1112,2005,1466,1592,3332,6244,3237,1089,572
852872,Aparatos receptores para televisión en color; sin radio receptor incorporado; aparatos reproductodes ...,0,0,0,0,0,51001,52004,9310,52189,22579,419,14914,43311,17725,410,435,313,296,176,571
030532,Filetes; secos; salados o en salmuera; sin ahumar; de peces de las familias Bregmacerotidae; ...,0,0,0,0,0,0,0,0,0,0,0,0,0,0,0,0,1,88,451,569
820810,Cuchillas y hojas cortantes; de metal común; para máquinas o aparatos mecánicos; para trabajar ...,47,46,113,198,307,328,810,350,385,250,574,518,777,711,840,650,762,766,471,566
950450,Consolas de videojuegos y máquinas (excepto los operados por cualquier medio de pago),0,0,0,0,0,0,0,0,0,0,492,281,2614,4724,1328,1284,595,213,1139,565
845819,Tornos horizontales que operen por arranque de metal sin control numérico,2298,1298,2325,1917,1553,2085,3306,2099,623,2308,1894,993,1598,1366,1479,1345,1056,1410,852,563
581100,Productos textiles acolchados en pieza; constituidos por una o varias capas de materia textil ...,336,669,1103,451,26,206,14,2023,1830,1594,789,452,223,326,509,749,823,780,391,562
848690,Máquinas y aparatos de un tipo usadas principalmente para la manufactura de galletas; mecanismos ...,0,0,0,0,0,15,1,65,98,59,89,197,15,81,94,26,3,5,20,561
854290,Partes de circuitos integrados y de microestructuras electrónicas; n.c.o.p.,7359,106,430,485,292,521,292,498,442,193,242,541,190,681,426,376,686,581,277,560
292219,"""Amino-alcoholes; sus éteres y sus ésteres; sales de estos productos (exc. con otras funciones ...",205,735,206,337,523,626,491,695,617,597,755,724,446,823,396,710,385,500,1029,557
843340,Prensas para paja o forraje (incl. las prensas recogedoras),936,950,285,1507,338,1035,956,1664,1796,1323,1666,2637,2419,1356,1466,731,955,1081,369,556
291560,Ácidos butanoicos; ácidos pentanoicos; sus sales y sus ésteres,9,190,30,133,121,1641,134,28,16,275,239,308,317,330,414,430,352,194,280,555
903031,Multímetros para medida de tensión; intensidad; resistencia o potencia eléctricas; sin dispositivo ...,110,107,99,64,159,534,246,189,292,214,347,201,347,229,344,390,236,310,373,553
844230,Máquinas; aparatos y material para fundir caracteres o para preparar o fabricar clisés; planchas; ...,157,112,69,58,8,154,384,242,247,145,197,583,218,270,561,211,276,293,682,552
860730,Ganchos y demás sistemas de enganche; topes; y sus partes; propios de vehículos para vías férreas; ...,40,121,75,175,310,5207,8797,6499,6930,8586,11100,20010,10563,5667,217,128,863,494,207,551
081290,Frutas y otros frutos conservados provisionalmente; p.ej. con gas sulfuroso o con agua salada ...,426,600,982,815,719,803,1308,1267,1343,1261,1126,1202,1401,1313,1176,937,888,738,622,549
270300,Turba (comprendida la utilizada para cama de animales); incluso aglomerada,7,16,6,9,0,91,94,131,26,7,127,488,336,589,550,665,565,589,345,548
070999,Hortalizas frescas o refrigeradas ncop,0,0,0,0,0,0,0,0,0,0,254,166,23,488,822,194,140,367,490,546
847890,Partes de máquinas y de aparatos para preparar o elaborar tabaco; n.c.o.p.,2362,2745,2744,1959,4075,4704,2782,2615,1727,1780,2041,3680,1623,1521,1290,1217,1240,739,825,545
845420,Lingoteras y cucharas de colada para metalurgia; acerías o fundiciones,2287,282,816,996,858,520,383,81,54,559,110,47,192,293,122,160,462,100,42,545
760410,Barras y perfiles; de aluminio sin alear; n.c.o.p.,615,140,111,371,1044,826,547,649,1350,1620,1808,4104,798,644,355,1071,508,399,435,544
251710,Cantos; grava; piedras machacadas; de los tipos generalmente utilizados para hacer hormigón; ...,112,6,161,357,560,667,465,535,957,1087,671,1141,1845,1872,1583,991,1202,1890,759,543
846711,Herramientas neumáticas; de uso manual; rotativas; incl. de percusión,8545,6733,394,459,297,580,1173,2521,717,1124,788,917,1002,983,760,363,472,434,415,542
200570,Aceitunas; preparadas o conservadas sin vinagre ni ácido acético (exc. congeladas),249,260,405,449,399,434,569,432,590,611,579,674,679,520,623,627,555,471,667,541
691390,Estatuillas y demás artículos para adorno; de cerámica distinta de la porcelana; n.c.o.p.,510,616,726,586,603,474,489,412,729,994,1337,930,832,506,584,572,536,556,386,539
590190,Transparentes textiles para calcar o dibujar; lienzos preparados para pintar; bucarán y telas ...,74,93,222,228,333,279,217,138,385,633,510,766,905,881,791,692,674,566,411,539
721921,Productos laminados planos de acero inoxidable; de anchura >= 600 mm; simplemente laminados ...,4840,5685,11344,16621,15513,25591,14142,15198,29614,47039,38786,20769,29947,28263,21999,16383,14011,9945,11800,538
290516,"""Octanol """"alcohol octílico"""" y sus isómeros""",9530,12010,10365,7054,17170,22912,17763,10707,33268,8633,13849,7871,6825,5805,645,2226,17680,2661,1537,536
392340,Bobinas; carretes; canillas y soportes simil.; de plástico,447,492,662,846,810,826,857,371,999,1349,1129,1331,2625,3357,1067,972,1299,942,508,534
731290,Eslingas y artículos simil.; de hierro o acero (exc. los artículos aislados para electricidad),87,65,253,243,248,415,489,276,167,548,599,437,454,137,515,259,204,252,387,534
760320,Polvo de aluminio; de estructura laminar; escamillas de aluminio (exc. granalla de aluminio ...,293,291,356,322,477,435,633,243,649,443,462,417,431,435,681,550,588,524,487,534
850433,Transformadores de tipo seco de potencia > 16 kVA pero <= 500 kVA,142,77,300,474,765,630,1541,1919,1177,953,2158,1354,1155,983,686,1340,1453,1416,706,533
841451,Ventiladores de mesa; pie; pared; cielo raso; techo; tejado o ventana; con motor eléctrico ...,959,701,1718,1851,1957,1151,1351,663,709,752,841,935,1667,459,577,711,936,804,337,532
600192,"""Terciopelo y felpa; de punto; de fibras sintéticas o artificiales (exc. los tejidos """"de pelo ...",5656,1806,2253,1914,3365,3477,4510,1607,4288,3006,4661,2976,1851,2523,1887,1860,1489,1667,592,531
401220,"""Neumáticos """"llantas neumáticas"""" usados; de caucho""",4,47,8,127,10,214,120,2,6,7,120,389,552,642,580,546,743,891,354,530
851850,Equipos eléctricos para amplificación de sonido,284,213,159,405,432,378,628,498,532,640,796,1650,1071,1140,308,319,424,251,568,530
722619,"""Productos planos de acero al silicio llam. """"magnético"""" """"acero magnético al silicio""""; de ...",597,727,1359,1781,1473,2417,1984,1461,738,1580,889,594,691,290,249,164,282,251,373,527
251511,Mármol y travertinos; en bruto o desbastados,59,686,524,122,160,153,155,222,134,155,709,326,1051,778,757,1320,3584,1606,977,525
270799,Aceites y demás productos de la destilación de los alquitranes de hulla de alta temperatura; ...,6474,2305,913,4924,5400,4741,7041,2433,1789,2483,2327,3473,1247,604,423,461,553,470,322,524
520811,Tejidos de algodón; con un contenido de algodón >= 85% en peso; de peso <= 100 g/m²; de ligamento ...,84,275,430,877,851,397,307,227,433,212,302,235,90,183,243,145,113,790,703,524
610423,Conjuntos de punto; de fibras sintéticas; para mujeres o niñas (exc. conjuntos de esquí y trajes ...,89,335,143,136,162,370,586,196,153,105,116,107,109,109,152,145,218,340,195,524
844540,Máquinas para bobinar; incluidas las canilleras; o devanar materia textil,118,81,31,188,70,221,622,276,229,456,305,446,1574,575,292,1737,135,199,440,523
880400,Paracaídas; incluidos los dirigibles; planeadores (parapentes) o de aspas giratorias; sus partes ...,551,108,78,340,691,644,1006,698,2960,727,777,1776,1645,1177,2174,3073,1945,2243,336,523
846691,Partes y accesorios de máquinas herramienta para trabajar piedra; cerámica; hormigón; amiantocemento ...,104,196,76,459,430,574,750,459,929,1820,1930,1475,985,1644,1652,1154,795,540,371,522
570250,"""Alfombras y demás revestimientos para el suelo; de lana o pelo fino; tejidos; distintos de ...",0,0,0,0,0,255,237,147,121,100,85,135,133,94,84,119,227,225,364,522
382478,"""Mezclas que contengan perfluorocarbonos """"PFCs"""" o hidrofluorocarbonos """"HFCs"""" pero sin contener ...",0,0,0,0,0,20,56,50,1,7,61,663,232,40,146,344,236,488,606,520
550962,Hilados con un alto contenido de fibras discontinuas acrílicas o modacrílicas; pero < 85% en ...,102,263,359,577,959,1653,1873,1531,1583,2295,2059,1776,1110,549,848,471,404,414,438,520
291732,Ortoftalatos de dioctilo,1466,5054,7361,4322,5226,6032,7052,2265,9522,6766,5742,3643,900,1019,485,115,728,17,54,519
401700,Caucho endurecido (por ejemplo: ebonita) en cualquier forma; incluidos los desechos y desperdicios; ...,164,43,76,181,232,305,204,105,147,187,241,279,382,334,203,117,532,507,537,516
811229,Manufacturas de cromo; n.c.o.p.,2,9,2,12,27,125,91,29,32,46,29,43,47,15,36,22,19,23,46,515
860729,Frenos distintos de los de aire comprimido; y sus partes; propios de vehículos para vías férreas; ...,216,3203,427,788,528,2024,831,735,1681,678,160,151,2378,1853,746,739,386,452,198,515
870130,Tractores de orugas (exc. motocultores de orugas),51549,735,1753,219,421,700,0,743,543,26,448,65,2944,434,1639,3054,760,2052,1000,513
850220,"""Grupos electrógenos con motor de émbolo """"pistón"""" de encendido por chispa """"motor de explosión""""""",125,307,233,141,191,179,152,1346,95,182,293,409,349,175,51,274,155,1164,5205,512
291714,Anhídrido maleico,1280,2414,6922,7143,5751,3706,5248,3109,5157,4165,4802,4241,2363,988,854,107,372,194,304,511
401150,"""Neumáticos """"llantas neumáticas"""" nuevos de caucho; de los tipos utilizados en bicicletas""",1654,4884,5064,3197,3279,2865,3309,2405,4644,3984,1153,862,890,800,437,154,9,570,482,510
251320,Esmeril; corindón natural; granate natural y demás abrasivos naturales; incl. tratados térmicamente,0,0,1,15,0,476,602,407,861,820,854,1117,1827,993,828,742,1395,1987,382,509
121300,Paja y cascabillo de cereales; en bruto; incluso picados; molidos; prensados o en pellets,1234,1259,860,10,712,16,89,119,53,0,0,3,4,1,5,0,56,56,129,509
521132,Tejidos de algodón; con un alto contenido de algodón; pero < 85% en peso; mezclado exclusiva ...,404,790,1175,642,1250,2157,1066,507,338,552,569,397,298,307,233,204,566,833,443,509
040390,"""Suero de mantequilla """"de manteca""""; leche y nata """"crema"""" cuajadas; kéfir y demás leches ...",5713,1519,1748,1480,1253,2840,3128,3861,3200,3108,3808,2672,2497,1013,366,656,568,560,501,509
741521,"""Arandelas; incl. las arandelas de muelle """"resorte""""; de cobre""",95,85,136,185,174,330,436,239,389,509,479,505,347,345,253,454,534,270,297,508
482320,"""Papel y cartón filtro; en tiras o en bobinas """"rollos"""" de anchura <= 36 cm o en hojas de ...",482,322,384,281,630,893,609,393,459,445,385,256,185,231,244,281,639,314,952,507
871496,Pedales y mecanismos de pedal; y sus partes; n.c.o.p.,173,723,927,725,719,561,838,429,596,642,378,281,426,267,192,212,166,161,221,507
490191,Diccionarios y enciclopedias; incl. en fascículos,43,170,79,301,162,93,145,89,307,518,147,70,8,49,9,9,43,930,750,506
820820,Cuchillas y hojas cortantes; de metal común; para máquinas o aparatos mecánicos; para trabajar ...,102,79,98,186,227,266,603,417,452,433,651,246,333,360,371,392,661,636,504,506
070960,"""Frutos de las géneros """"Capsicum"""" o """"Pimenta""""; frescos o refrigerados""",82,131,90,402,590,523,316,106,146,11,6,0,15,87,91,3,151,983,489,505
520511,"""Hilados de algodón; sencillos; de fibras sin peinar; con un contenido de algodón >= 85% en ...",371,766,444,484,410,424,848,50,495,16,949,566,13,54,171,65,463,108,241,504
252800,Boratos naturales y sus concentrados (incluso calcinados); excepto los boratos extraídos de ...,0,0,0,0,0,0,0,0,0,0,17,25,23,65,42,48,57,101,74,503
580137,Urdimbre pila; de fibras sintéticas o artificiales (excepto con bucles del tipo Tejidos; Tejidos ...,0,0,0,0,0,0,0,0,0,0,0,15,98,139,90,37,159,354,326,502
850519,Imanes permanentes y artículos destinados a ser imantados permanentemente; de materias distintas ...,1740,1366,1633,1411,1315,1129,1083,664,761,1028,602,657,1069,657,459,525,553,709,480,502
850410,"""Balastos """"reactancias"""" para lámparas o tubos de descarga""",2774,2964,6622,9416,8375,9270,7894,5263,6221,4969,3397,6577,4808,2960,1680,1350,1732,1406,1421,501
284440,Elementos e isótopos y compuestos; radiactivos; así como aleaciones; dispersiones; incl. el ...,83,328,213,344,254,291,430,539,232,286,756,348,339,520,519,1107,669,1124,590,501
846039,Máquinas de afilar para metal; de control no numérico,279,267,1046,430,312,1034,1354,466,512,321,628,191,322,252,369,413,227,337,208,500
520931,Tejidos de algodón; con un contenido de algodón >= 85% en peso; de peso > 200 g/m²; de ligamento ...,1434,3020,3013,2916,1997,1786,1321,738,1095,1221,1159,760,554,324,524,511,376,366,186,500
740931,"""Chapas y tiras; de aleaciones a base de cobre-estaño """"bronce""""; de espesor > 0;15 mm; enrolladas ...",0,14,0,1,13,30,422,1,39,16,37,9,17,10,13,64,115,68,259,499
250590,Arenas naturales de cualquier clase; incl. coloreadas (exc. arenas auríferas y platiníferas; ...,35,6,4,5,6,14,422,113,18,17,12,27,31,57,146,47,72,54,77,498
920994,Partes y accesorios de instrumentos musicales en los que el sonido se produzca o tenga que ...,123,94,93,287,290,199,121,71,137,129,78,32,38,26,108,333,337,370,402,498
320620,Pigmentos y preparaciones a base de compuestos de cromo; del tipo de las usadas para colorear ...,676,295,368,319,184,321,422,334,488,633,877,955,849,433,431,440,415,410,272,497
842420,Pistolas aerográficas y aparatos simil. (exc. máquinas y aparatos eléctricos para proyectar ...,501,304,489,961,1234,1270,1878,1556,1501,5285,1981,1744,1626,1630,1449,1416,490,374,442,495
200971,Jugo de manzana; sin fermentar y sin adición de alcohol; incl. con adición de azúcar u otro ...,102,18,14,57,27,17,54,5,13,0,7,6,15,10,75,20,203,337,414,495
740610,Polvo de estructura no laminar; de cobre (exc. granallas de cobre),32,0,1,97,175,143,114,223,190,217,1184,620,1246,538,280,79,102,105,163,495
846150,Máquinas de aserrar o trocear; para metal (exc. máquinas accionadas manualmente),138,361,1752,1562,649,1247,3634,796,433,2071,522,712,827,949,771,1532,832,856,620,492
820412,Llaves de ajuste de mano; incl. las llaves dinamométricas; de metal común; de boca ajustable,78,104,392,622,730,862,1055,650,842,1007,913,753,590,552,537,529,492,499,334,492
551311,Tejidos de fibras sintéticas discontinuas; con un alto contenido de fibras discontinuas de ...,1910,2261,2204,3627,3527,4035,3996,3286,3532,3864,3845,3829,4557,5544,2311,650,919,1068,610,490
840220,"""Calderas denominadas """"de agua sobrecalentada""""""",3352,1983,2254,9751,3350,4124,4743,0,7528,11696,9558,39679,2452,284,2,124,0,357,78,489
470730,"""Papel o cartón para reciclar """"desperdicios y desechos""""; obtenido principalmente a partir ...",155,72,36,64,50,139,1,4,130,3267,3910,4698,4114,12638,3254,4547,1673,0,245,489
621143,"""Conjuntos de abrigo para entrenamiento o deporte """"chandales""""; así como otras prendas de ...",49,455,181,182,283,249,359,197,429,470,380,364,661,1028,1280,1301,831,710,662,488
320490,Productos orgánicos sintéticos de los tipos utilizados como luminóforos; incl. de constitución ...,23,203,20,166,167,103,209,327,513,440,435,518,567,486,253,237,121,170,153,484
711029,Paladio; semilabrado,0,0,0,0,0,0,4,0,0,328,406,0,0,5,367,330,19,56,272,484
852329,Aparatos magneticos para grabación de sonidos o otros fonemas (exc. targetas incorporadas y ...,0,0,0,0,0,340,367,461,656,1385,1253,467,194,151,324,163,501,350,342,484
880212,Helicópteros de peso en vacío> 2.000 kg (exc. los no tripulados de la partida 8806),15237,8952,7808,6410,8797,12594,0,9691,0,960,12514,3900,0,12636,73152,17583,956,0,0,482
870290,"""Vehículos automóviles para transporte de >= 10 personas; incl. el conductor; con motor que ...",791,464,299,388,752,16,11,236,8,17,0,53,129,463,492,84,24,177,0,482
843590,Partes de prensas; de estrujadoras y de máquinas y de aparatos análogos para la producción ...,243,644,1169,1396,2483,2576,2366,1255,2081,2646,2293,2423,2645,2277,1201,1465,1512,1862,914,481
846249,Máquinas de punzonar; entallar o mordisquear para productos planos incl. Máquinas combinadas ...,71,68,176,694,344,266,340,583,798,471,427,510,198,1603,508,2234,470,453,183,481
611130,"""Prendas y complementos """"accesorios"""" de vestir; de punto; de fibras sintéticas; para bebés ...",50,54,190,187,188,485,384,118,171,139,86,77,69,58,101,150,292,369,274,481
621010,"""Prendas de vestir confeccionadas con fieltro y tela sin tejer; incl. impregnadas; recubiertas; ...",212,523,669,1268,2383,2144,2172,550,225,898,667,284,212,489,346,521,402,337,5202,479
845121,Máquinas para secar ropa; de capacidad unitaria; expresada en peso de ropa seca <= 10 kg (exc. ...,120,406,1188,169,281,289,592,320,548,752,275,838,925,920,416,754,851,603,382,478
841920,Esterilizadores médicos; quirúrgicos o de laboratorio,425,555,1047,1570,2189,4664,3960,2251,2331,1810,1199,1262,1016,1814,1120,1419,1668,2765,727,478
853929,"""Lámparas y tubos eléctricos de incandescencia (exc. lámparas y tubos halógenos de volframio ...",2747,4057,5123,4938,6559,5879,4864,2961,2551,1236,1708,454,402,500,370,481,746,491,360,478
