Código,Descripción del producto,Valor exportado en 2002,Valor exportado en 2003,Valor exportado en 2004,Valor exportado en 2005,Valor exportado en 2006,Valor exportado en 2007,Valor exportado en 2008,Valor exportado en 2009,Valor exportado en 2010,Valor exportado en 2011,Valor exportado en 2012,Valor exportado en 2013,Valor exportado en 2014,Valor exportado en 2015,Valor exportado en 2016,Valor exportado en 2017,Valor exportado en 2018,Valor exportado en 2019,Valor exportado en 2020,Valor exportado en 2021
854081,Tubos receptores o amplificadores (exc. tubos para hiperfrecuencias; tubos de fotocátodos y ...,0,0,0,0,0,0,0,1,5,1,0,23,1,5,0,2,2,1,0,11
091091,Mezclas de especias diversas,0,50,0,0,0,0,0,4,1,1,0,0,1,0,53,1,13,46,21,11
030699,Crustáceos; aptos para la alimentación humana; incluso pelados; secos; salados; ahumados o ...,0,0,0,0,0,0,0,0,0,0,0,0,0,0,0,456,115,2,4,11
020423,Carnes deshuesadas de ovinos; frescas o refrigeradas,0,0,0,0,0,2,0,0,0,0,0,0,0,0,0,0,1,11,9,11
910690,Aparatos de control de tiempo y contadores de tiempo; con mecanismo de relojería o motor sincrónico ...,55,37,31,67,41,70,61,66,72,65,37,17,34,252,94,2,20,37,17,11
840310,"""Calderas para calefacción central; no eléctricas (exc. calderas de vapor y calderas denominadas ...",28,13,14,8,78,518,166,457,100,56,367,9,68,199,140,283,61,24,12,10
847010,"""Calculadoras electrónicas que funcionen sin fuente de electricidad exterior y máquinas de ...",2,1,2,8,2,8,16,28,18,4,1,14,2,2,10,3,6,5,13,10
440210,"""Bambú vegetal; incl. el de cáscaras o de huesos """"carozos"""" de frutas; aunque esté aglomerado ...",0,0,0,0,0,0,0,0,0,0,0,0,0,0,0,0,1,14,6,10
401410,Preservativos; de caucho vulcanizado sin endurecer,126,399,395,206,108,212,772,202,84,44,173,512,349,33,4,26,7,9,15,10
392114,Placas; láminas; hojas y tiras; de celulosa celular regenerada; sin trabajar o trabajadas solo ...,0,3,0,0,6,12,2,0,1,3,42,1,1,4,1,10,6,16,7,10
210420,Preparaciones para la alimentación infantil o para usos dietéticos que consistan en una mezcla ...,352,1999,2846,1394,570,285,171,129,4509,10970,58,218,22,71,136,112,147,80,12,10
280410,Hidrógeno,3,9,4,8,4,5,2,12,19,33,10,28,8,8,9,19,47,8,1,10
292620,"""1-Cianoguanidina """"diciandiamida""""""",1,1,0,1,37,4,1,2,0,0,0,0,1,8,0,0,0,1,0,10
510910,Hilados con un contenido de lana o pelo fino >= 85% en peso; acondicionados para la venta al ...,3,2,36,9,6,7,6,5,5,5,7,7,6,11,5,5,2,3,9,10
520813,Tejidos de algodón; con un contenido de algodón >= 85% en peso; de peso <= 200 g/m²; de ligamento ...,58,105,352,504,640,16,16,43,33,0,2,0,0,8,15,12,4,6,4,10
520611,"""Hilados de algodón; con un alto contenido de algodón; pero < 85% en peso; sencillos; de fibras ...",0,0,8,2,0,0,0,0,0,1,19,17,27,112,149,168,72,0,4,10
521152,Tejidos de algodón; con un alto contenido de algodón; pero < 85% en peso; mezclado exclusiva ...,12,197,294,104,130,0,155,312,42,24,45,268,98,61,80,56,66,36,10,10
482050,Álbumes para muestras o para colecciones; de papel o cartón,93,121,165,266,146,170,157,12,12,10,3,6,12,10,4,4,94,4,3,10
620431,"""Chaquetas """"sacos"""" de lana o pelo fino; para mujeres o niñas (exc. de punto; así como cazadoras ...",9,8,22,29,99,101,51,56,24,13,2,32,30,23,9,57,37,19,16,10
620333,"""Chaquetas """"sacos"""" de fibras sintéticas; para hombres o niños (exc. de punto; cazadoras y ...",12,79,46,29,54,16,56,9,35,17,356,741,128,407,95,29,154,53,22,10
620413,Trajes sastre; de fibras sintéticas; para mujeres o niñas (exc. de punto; así como monos de ...,3,8,5,7,14,17,16,3,5,4,3,10,12,9,4,16,1,16,2,10
691410,Manufacturas de porcelana; n.c.o.p.,30,40,75,75,23,27,53,20,7,3,3,6,34,4,3,15,34,25,5,10
540120,Hilos de coser de filamentos artificiales; incl. acondicionados para la venta al por menor,7,10,6,36,31,41,122,371,265,166,49,15,42,11,2,11,1,22,1,10
550961,Hilados con un alto contenido de fibras discontinuas acrílicas o modacrílicas; pero < 85% en ...,78,217,192,125,39,47,175,164,145,236,163,42,80,51,32,45,0,0,0,10
570291,"""Alfombras y demás revestimientos para el suelo; de lana o pelo fino; tejidos; distintos de ...",1,8,16,2,48,44,24,15,25,22,24,9,15,16,37,13,27,12,11,10
580126,Tejidos de chenilla; de algodón (exc. los de punto y tejidos con bucles para toallas; superficies ...,28,103,230,411,431,631,655,728,671,723,503,297,195,3,40,5,4,0,2,10
610210,"""Abrigos; chaquetones; capas; anoraks; cazadoras y artículos simil.; de punto de lana o pelo ...",1,1,3,12,8,5,137,35,18,8,13,61,18,11,11,4,21,14,4,10
600543,"""Tejidos de punto por urdimbre; incl. los obtenidos en telares de pasamanería; de anchura > ...",0,0,0,0,0,0,0,0,4,1,1,0,0,0,0,1,0,0,0,10
721041,Productos planos de hierro o acero sin alear; de anchura >= 600 mm; laminados en frío o en ...,156,64,131,38,83,125,31,43,5,33,9,34,169,23,13,17,150,12,20,10
851621,Radiadores de acumulación; eléctricos; para la calefacción de locales,0,5,13,0,0,0,0,16,2,163,0,0,0,0,0,0,0,18,6,10
020890,"""Carne y despojos comestibles frescos; refrigerados o congelados de palomas; caza; renos y ...",208,478,551,883,978,1414,1355,1334,2579,1031,761,560,535,86,0,22,8,11,16,10
030721,Vieiras y otros moluscos de la familia Pectinidae; vivos; frescos o refrigerados; incluso con ...,0,0,0,0,0,0,0,0,0,0,0,0,0,0,0,0,2,9,7,10
030562,"""Bacalao """"Gadus morhua; Gadus ogac; Gadus macrocephalus""""; (exc. ??filetes y vísceras) salados ...",0,0,0,0,0,0,0,0,0,0,0,0,0,0,0,0,1,66,231,10
071390,Legumbres secas; legumbres sin cáscara; incluso mondadas o partidas (exc. ??guisantes; garbanzos; ...,0,15,0,19,2,0,0,1,20,0,0,40,0,2,0,0,2,8,5,10
080251,Pistachos frescos o secos; con cáscara,0,0,0,0,0,0,0,0,0,0,5,20,16,14,0,0,1,13,11,10
100290,Centemp (exc. ??las semillas para siembra),0,0,0,0,0,0,0,0,0,0,1,1,0,0,0,0,13,0,4,10
847210,Copiadoras hectográficas; incl. los mimeógrafos (exc. máquinas para imprimir; así como los ...,0,0,31,64,3,0,1,0,0,0,4,0,0,0,0,0,0,0,0,9
845970,"""Máquinas de roscar """"incl. aterrajar"""" metal (exc. unidades de mecanizado de corredera)""",2538,37,38,59,34,311,153,90,67,20,16,318,38,77,164,57,740,497,83,9
846520,Centros de mecanizado para trabajar madera; corcho; hueso; caucho endurecido; plástico rígido ...,0,0,0,0,0,0,0,0,0,0,0,0,0,0,0,822,231,0,0,9
844610,Telares para tejidos de anchura <= 30 cm,0,0,0,65,0,0,0,0,0,0,2293,27,780,100,171,74,30,8,210,9
845521,Laminadores para metal; para laminar en caliente o combinados para laminar en caliente y en ...,0,22,25,136,129,0,0,603,0,0,0,2,35171,159,715,482,34,606,77,9
841012,Turbinas hidráulicas y ruedas hidráulicas; de potencia > 1.000 kW pero <= 10.000 kW (exc. motores ...,3529,6,857,438,663,310,580,638,96,2855,363,350,209,232,581,1911,1095,11,22,9
390490,"""Polímeros de cloruro de vinilo o de otras olefinas halogenadas; en formas primarias (exc. ...",18,3,64,43,0,15,29,0,30,2,19,59,20,0,91,1,9,57,24,9
251120,"""Carbonato de bario natural """"witherita""""; incl. calcinado""",0,1,1,4,25,2,34,30,54,47,69,29,24,32,6,20,42,55,12,9
170220,"""Azúcar sólido de arce [""""maple""""] y jarabe de arce [""""maple""""]; sin adición de aromatizante ...",45,28,36,243,35,44,57,67,83,0,0,1,0,0,0,0,1,1534,1490,9
170390,Melaza de remolacha; procedente de la extracción o del refinado del azúcar,0,1,1,5,3,15,6,4,0,0,3,1,1,91,42,1,37,4,4,9
160416,Preparaciones y conservas de anchoa; entera o en trozos (exc. picada),0,0,0,0,0,0,0,0,0,0,0,0,0,0,0,0,1,8,9,9
292411,"""Meprobamato """"DCI""""""",0,0,0,0,0,0,0,0,0,0,0,0,0,0,0,0,0,0,0,9
293625,Vitamina B6 y sus derivados utilizados principalmente como vitaminas,0,0,8,4,0,83,1,6,0,9,7,4,5,10,114,23,136,6,108,9
290722,Hidroquinona y sus sales,1,521,354,253,70,14,13,35,126,521,9,24,112,298,14,318,227,154,4,9
292144,Difenilamina y sus derivados; sales de estos productos,68,1417,1252,1545,1104,1437,1055,635,1279,818,1069,800,618,473,419,690,1040,1,3,9
290391,Clorobenceno; o-diclorobenceno y p-diclorobenceno,0,0,0,0,0,0,0,0,0,0,72,34,41,45,1,0,0,39,14,9
290549,"""Tri- y otros polialcoholes acíclicos (exc. 2-etil-2-""""hidroximetil""""propan-1;3- diol """"trimetilolpropano""""; ...",86,115,39,224,0,9,45,83,101,479,165,886,1084,512,595,113,8,23,308,9
481490,Wallpaper y revestimientos similares de paredes de papel; y papel para vidrieras (sin revestimientos ...,0,0,53,3,5,2,23,32,7,5,6,14,0,13,0,1,2,0,0,9
470421,Pasta química de madera de coníferas; al sulfito; semiblanqueada o blanqueada (exc. pasta para ...,0,2,2,38,45,65,17,14,18,0,4,0,0,0,0,0,0,0,0,9
470610,Pasta de línter de algodón,62,62,134,151,5160,11105,15193,5936,9668,9949,23,512,1585,1793,751,25,35,25,21,9
460121,Esterillas y biombos de materials plateados de bambú; platelminto o unidos en paralelo,0,0,0,0,0,0,0,1,0,0,44,0,0,0,0,0,2,4,0,9
720310,"""Productos férreos obtenidos por reducción directa de minerales de hierro; en trozos; """"pellets"""" ...",1947,0,169,585,1480,1286,2931,674,18,17,28,16,45,7,4,1,1,3,23,9
620719,"""Calzoncillos; incl. los largos y los """"slips""""; de materia textil; para hombres o niños (exc. ...",12,6,12,18,10,20,18,14,16,4,10,18,23,48,40,70,6,11,9,9
620332,"""Chaquetas """"sacos"""" de algodón; para hombres o niños (exc. de punto; cazadoras y artículos ...",16,105,87,118,300,163,78,122,80,26,174,110,70,67,31,58,20,62,18,9
600330,"""Tejidos de punto; de anchura <= 30 cm; de fibras sintéticas (exc. con un contenido de hilados ...",0,0,0,0,131,168,136,183,154,185,182,157,135,134,137,52,4,6,31,9
600390,"""Tejidos de punto; de anchura <= 30 cm (exc. de lana o pelo fino; de algodón; de fibras sintéticas ...",0,3,0,1,0,0,0,0,0,2,2,1,0,0,0,25,4,0,4,9
600121,Tejidos con bucles; de punto; de algodón,145,792,1316,225,82,40,54,49,194,2,27,14,21,6,18,18,4,12,13,9
610811,"""Combinaciones y enaguas; de punto; de fibras sintéticas o artificiales; para mujeres o niñas ...",3,13,19,10,24,12,27,17,52,13,10,31,6,17,12,38,6,12,9,9
730120,Perfiles de hierro o acero; obtenidos por soldadura,16,63,183,118,446,226,274,333,100,123,58,2,116,0,1,2,117,131,9,9
850870,Partes de aspiradoras; incl. las de materias secas y líquidas; n.c.o.p.,0,0,0,0,0,24,44,32,32,80,36,44,73,234,200,40,52,61,9,9
854099,Partes de lámparas; de tubos y de válvulas electrónicos de cátodo caliente; cátodo frío o fotocátodo; ...,0,0,0,1,2,3,22,0,1,2,0,0,0,0,2,4,1,10,1,9
900661,"""Aparatos de tubo de descarga para producir destellos para fotografía """"flashes electrónicos""""""",0,0,0,1,1,0,7,0,6,77,5,6,3,7,0,40,1,0,2,9
901180,Microscopios ópticos (exc. para fotomicrografía; cinefotomicrografía o microproyección; microscopios ...,69,161,237,406,410,217,290,214,237,236,316,212,844,296,426,271,246,219,33,9
880260,Vehículos espaciales; incl. los satélites; y sus vehículos de lanzamiento y vehículos suborbitales,0,0,0,450,348,34308,0,625,0,1616,0,1333,213,1019,0,0,0,0,0,9
100829,Mijo (sorgo de grano excluida; y la semilla para la siembra),0,0,0,0,0,0,0,0,0,0,1,1,0,0,0,0,11,123,127,9
110430,Germen de cereales entero; aplastado; en copos o molido,42,229,24,84,4,29,3,1,16,39,23,35,16,5,7,0,2,5,7,9
090611,"""Canela """"Cinnarmomum zeylanicum Blume"""" (exc. sin triturar ni pulverizar)""",0,0,0,0,0,1,5,13,12,7,8,9,7,5,6,3,5,4,7,9
030569,Pescado salado o en salmuera (exc. ??filetes; despojos; el arenque; el bacalao; las anchoas; ...,53,8,0,1,0,0,0,0,0,0,0,20,0,0,0,0,88,6,94,9
030615,"""Langostas congeladas Noruega """"Nephrops norvegicus""""; incluso ahumado; incluso pelados o no; ...",0,0,0,0,0,0,0,0,0,0,0,0,0,4,134,150,1,10,16,9
910599,Relojes (exc. eléctricos; así como los relojes de pulsera; bolsillo y relojes simil. de las ...,0,24,52,23,32,11,100,75,7,7,16,3,195,9,1,2,0,0,4,9
910820,Pequeños mecanismos de relojería completos y montados; automáticos,0,5,0,0,0,0,0,0,0,25,0,0,13,0,0,8,19,29,0,9
847690,Partes de máquinas automáticas para la venta de productos; incl. las máquinas de cambiar monedas; ...,85,38,13,1,8,86,23,80,0,2,0,1,1,6,1,2,13,944,3,8
440140,Aserrín; desperdicios y desechos; de madera; sin aglomerar,0,0,0,0,0,0,0,0,0,0,0,0,0,0,0,0,10,8,5,8
291212,"""Etanal """"acetaldehído""""""",2,0,140,190,25,2,19,0,1,11,0,0,1,0,0,0,0,0,147,8
470693,"""Pasta de materias fibrosas celulósicas; semiquímicas (exc. de madera y de línter de algodón; ...",0,0,0,0,0,0,0,0,0,4,7,1,0,0,22,0,0,12,0,8
480630,"""Papel vegetal """"papel calco""""; en bobinas """"rollos"""" de anchura > 36 cm o en hojas de forma ...",12,86,18,18,18,11,8,5,5,7,9,22,7,5,5,16,3,17,22,8
520941,Tejidos de algodón; con un contenido de algodón >= 85% en peso; de peso > 200 g/m²; de ligamento ...,6117,8014,7059,3417,1458,318,588,115,1266,89,30,264,1,7,0,0,0,4,12,8
520543,"""Hilados de algodón; retorcidos o cableados; de fibras peinadas; con un contenido de algodón ...",77,53,27,38,46,9,28,12,5,13,16,18,17,10,9,10,9,7,0,8
620331,"""Chaquetas """"sacos"""" de lana o pelo fino; para hombres o niños (exc. de punto; así como cazadoras ...",3,215,57,205,30,52,60,200,123,38,10,119,189,37,27,154,32,16,4,8
620811,Combinaciones y enaguas; de fibras sintéticas o artificiales; para mujeres o niñas (exc. de ...,5,12,15,41,127,115,71,101,96,34,45,49,38,30,5,24,8,9,6,8
630520,"""Sacos """"bolsas"""" y talegas; para envasar; de algodón""",14983,13359,15231,10838,5717,8962,74,40,15,57,16,3,20,12,1,238,195,136,189,8
630312,Visillos y cortinas; guardamalletas y ropadiés de cama; de punto; de fibras sintéticas (exc. ...,54,234,239,191,63,384,148,66,189,160,42,31,76,35,111,7,41,13,10,8
670490,Pelucas; barbas; cejas; pestañas; mechones y artículos análogos; de pelo o materia textil (exc. ...,0,0,12,0,1,27,0,0,0,0,0,2,0,1,0,0,0,2,0,8
610431,"""Chaquetas """"sacos"""" de punto; de lana o pelo fino; para mujeres o niñas (exc. cazadoras y ...",8,5,20,6,9,7,1,2,2,2,0,2,6,0,1,0,2,0,1,8
610339,"""Chaquetas """"sacos"""" de punto; de materia textil; para hombres o niños (exc. de lana o pelo ...",0,0,0,7,1,9,2,4,3,6,5,2,1,1,5,2,3,0,2,8
610310,Anoraks; cazadoras y artículos simil.; de punto de materia textil; para hombres o niños (exc. ...,0,0,0,0,0,79,9,231,206,0,86,1,1,0,0,0,27,54,6,8
852842,"""De rayos catódicos monitores de tubo """"CRT"""" capaz de conectar directamente con y diseñado ...",0,0,0,0,0,0,0,0,0,0,0,0,0,0,0,86,66,107,1,8
090931,Semillas de comino; sin triturar ni pulverizar,0,0,0,0,0,0,0,0,0,0,2,15,0,2,0,0,1,1,83,8
080590,"""Agrios """"cítricos""""; frescos o secos (exc. naranjas; limones """"Citrus limon; Citrus limonum""""; ...",63,390,463,514,634,873,1215,342,5,115,160,1,1,19,1,0,3,9,15,8
060210,Esquejes sin enraizar e injertos,9,0,7,15,0,1,2,0,58,0,4,22,167,366,93,199,159,3,0,8
071151,"""Setas y demás hongos del género """"Agaricus""""; conservadas provisionalmente; p.ej.; con gas ...",0,0,0,0,2,1,0,0,14,8,4,2,1,0,4,3,1,6,5,8
071022,"""Judías """"porotos; alubias; frijoles; fréjoles"""" """"Vigna spp.""""; """"Phaseolus spp.""""; aunque ...",0,0,0,2,9,0,0,0,19,1,0,0,0,0,0,0,26,9,9,8
910890,Pequeños mecanismos de relojería completos y montados; manuales,0,1,0,0,3,0,16,0,0,0,0,0,0,0,0,0,1,5,0,8
846140,Máquinas de tallar o acabar engranajes; para metal (exc. máquinas de cepillar; limar; mortajar ...,4,54,403,326,130,1321,0,21,0,0,0,117,2486,102,112,2,275,43,0,7
842211,Máquinas para lavar vajilla; de tipo doméstico,209,624,1305,1404,1251,1844,1572,170,296,4,8,0,3,3,0,4,8,5,7,7
391510,Desechos; desperdicios y recortes; de polímeros de etileno,542,548,1471,125,263,13,102,26,586,546,224,33,899,155,691,0,17,0,14,7
130211,Opio,3,16,1553,1584,266,38,27,28,17,5,0,0,0,0,0,3,0,0,0,7
160529,Camarones y langostinos; preparados o conservados; en envases herméticamente cerrados (sin ...,0,0,0,0,0,0,0,0,0,0,11,122,2,0,50,0,1,9,14,7
252321,Cemento Portland; blanco; incl. coloreado artificialmente,460,1007,1076,1044,516,1059,661,88,1,34,0,59,91,14,2,0,0,2,58,7
282490,"""Óxidos de plomo (excepto el monóxido de """"litargirio; óxido de plomo"""")""",0,0,0,0,37,315,336,0,41,0,15,0,0,0,1,1,0,0,0,7
284610,Compuestos de cerio,0,2,2,7,351,1082,659,385,365,16,4,6,3,6,6,2,15,3,1,7
300310,Medicamentos; que contengan penicilinas o derivados de estos productos con la estructura del ...,0,0,2,11,1,15,2,0,23,0,60,0,0,71,100,0,0,110,4,7
481850,"""Prendas y complementos """"accesorios"""" de vestir; de pasta de papel; de papel; de guata de ...",0,1,0,0,0,0,0,3,16,0,25,0,3,0,31,42,1,1,1,7
490810,Calcomanías vitrificables,36,97,44,71,29,27,13,18,31,41,18,7,15,20,7,46,39,1,2,7
450390,Manufacturas de corcho natural (exc. cubos; planchas; hojas o tiras cuadradas o rectangulares; ...,0,7,19,2,20,9,183,71,100,45,87,114,101,100,70,7,1,4,0,7
620412,Trajes sastre; de algodón; para mujeres o niñas (exc. de punto; así como monos de esquí y trajes ...,6,3,19,88,10,12,17,75,20,3,2,52,4,5,2,5,3,6,3,7
611522,"""Calzas; """"panty-medias"""" y leotardos; de punto; de fibras sintéticas; de título >= 67 decitex ...",0,0,0,0,0,177,216,530,263,305,136,74,78,34,34,65,22,26,8,7
580810,Trenzas de materias textil; en pieza,33,37,50,63,61,94,63,35,91,91,82,79,89,61,70,48,38,44,9,7
551621,Tejidos con un alto contenido de fibras artificiales discontinuas; pero < 85% en peso; mezcladas ...,11,8,13,6,4,1,0,0,0,0,5,2,1,1,16,4,0,0,29,7
731581,"""Cadenas de eslabones con contrete """"travesaño""""; de fundición; hierro o acero""",419,175,5236,2158,7007,14498,4303,50,4,36,148,98,154,120,35,60,46,121,52,7
721913,Productos laminados planos de acero inoxidable; de anchura >= 600 mm; simplemente laminados ...,28815,51578,41254,53526,35280,35478,15226,10421,15773,8699,1177,8490,2937,18103,30986,16975,7465,2881,933,7
780419,Chapas de plomo; hojas y tiras; de plomo; de espesor > 0;2 mm; sin incluir el soporte,28,5,4,29,18,40,20,2,715,138,90,140,37,4,14,1,1,11,8,7
851010,Afeitadoras; eléctricas,9,101,0,1,20,101,25,27,1,1,3,4,2,42,13,22,3,20,7,7
850660,Pilas y baterías de pilas; de cinc-aire (exc. inservibles),10,34,32,37,39,45,34,21,21,16,14,144,2,0,22,13,4,1,5,7
870911,Carretillas eléctricas sin dispositivo de elevación de los tipos utilizados para transporte ...,1,11,38,90,0,6,0,0,105,444,145,159,396,150,371,63,208,452,0,7
901540,Instrumentos y aparatos de fotogrametría,20,1,1,229,3,0,0,7,6,0,0,600,0,0,46,168,30,162,6,7
090812,Nuez moscada; triturada o pulverizada,0,0,0,0,0,0,0,0,0,0,0,3,3,1,0,2,1,4,10,7
081110,"""Fresas """"frutillas""""; sin cocer o cocidas en agua o vapor; congeladas; con adición de azúcar ...",9,0,32,3,36,34,19,11,10,17,261,14,14,9,4,7,10,18,16,7
030732,"""Mejillones """"Mytilus spp.; Perna spp.""""; Congelados; incluso con cáscara""",0,0,0,0,0,0,0,0,0,0,0,0,0,0,0,0,0,0,3,7
030345,Atún del Atlántico y el atún rojo del Pacífico (Thunnus thynnus; Thunnus orientalis) congelados,0,359,176,0,0,0,0,0,0,0,0,0,0,0,0,0,1,7,8,7
030432,"""Filetes frescos o refrigerados de bagre """"Pangasius spp. Silurus spp. Clarias spp. Ictalurus ...",0,0,0,0,0,0,0,0,0,0,5,3,0,1,14,2,2,20,16,7
030439,"""Filetes frescos o refrigerados de la carpa """"Cyprinus carpio; Carassius carassius; Ctenopharyngodon ...",0,0,0,0,0,0,0,0,0,0,1,0,0,0,0,0,2,17,18,7
030231,"""Albacoras o atunes blancos """"Thunnus alalunga""""; frescos o refrigerados""",48,96,16,4,106,9,2,5,0,0,0,0,0,0,6,0,146,17,6,7
030242,"""Anchoas """"Engraulis spp.""""; frescas o refrigeradas""",0,0,0,0,0,0,0,0,0,0,0,0,0,0,0,0,2,5,11,7
020110,Canales o medias canales; de bovinos; frescas o refrigeradas,0,0,0,0,0,7,0,0,0,0,0,0,0,0,0,0,0,2,4,7
920510,"""Instrumentos llam. """"metales""""""",1723,1520,2095,2355,2725,2047,1765,1385,729,437,466,65,131,45,48,27,9,17,2,7
960850,Juegos de artículos pertenecientes; por lo menos; a dos de los artículos siguientes: bolígrafos; ...,85,6,3,4,10,15,3,3,15,8,17,1,85,16,1,4,1,2,2,7
845720,Máquinas de puesto fijo; para trabajar metal,57,0,173,28,120,755,708,26,1,0,14,350,20,0,40,6,0,4,2,6
847629,Máquinas automáticas para la venta de bebidas; sin dispositivo de calentamiento o refrigeración ...,0,6,0,0,0,0,0,0,0,0,2,0,0,0,0,176,0,19,0,6
848630,Máquinas y aparatos para la manufactura de paneles,0,0,0,0,0,0,0,0,0,0,0,0,0,0,0,0,0,0,0,6
382550,Desechos de soluciones decapantes; fluidos hidráulicos; líquidos para frenos y líquidos an ...,0,0,0,0,0,0,2,0,0,0,0,0,0,0,0,0,0,0,3,6
400249,"""Caucho cloropreno """"clorobutadieno"""" """"CR""""; en formas primarias o en placas; hojas o tiras ...",39,3,30,70,156,94,114,44,6,3,16,41,148,31,35,264,78,6,38,6
240290,"""Cigarros """"puros""""; incl. despuntados; cigarritos """"puritos"""" y cigarrillos; exclusivamente ...",0,0,0,0,0,0,0,0,0,0,0,0,0,0,0,0,0,2,0,6
261900,Escorias (excepto las granuladas); batiduras y demás desperdicios de la siderurgia,0,57,60,27,22,17,2215,29,0,66,133,404,432,86,0,0,0,17,0,6
200559,"""Judías """"porotos; alubias; frijoles; fréjoles"""" """"Vigna spp.""""; """"Phaseolus spp.""""; preparadas ...",3,204,3,39,14,218,20,1,16,75,5,5,5,1,1,1,2,7,5,6
200560,Espárragos; preparados o conservados sin vinagre ni ácido acético; sin congelar,1,3,2,8,2,1,7,8,11,15,14,15,17,8,8,12,2,33,7,6
120400,Semilla de lino; incluso quebrantada,0,4,0,48,1,1,2,8,15,5,9,17,9,2,2,4,9,26,7,6
293959,"""Teofilina y aminofilina """"teofilina-etilendiamina"""" y sus derivados; sales de estos productos ...",0,0,1,0,0,11,0,0,0,1,1,875,0,0,0,0,97,0,0,6
285390,Fosfuros; ya sea de constitución química definida (exc ferrofósforos.); compuestos inorgánicos; ...,0,0,0,0,0,0,0,0,0,0,0,0,0,0,0,11,40,49,8,6
290322,Tricloroetileno,6,5,12,12,11,17,29,7,15,40,35,27,6,3,3,4,0,1,6,6
460212,"""Artículos de cestería confeccionados con artículos de materia vegetal de la partida 4601; ...",0,0,0,0,0,1,6,3,10,3,0,1,4,4,1,0,1,2,7,6
441194,"""Tableros de fibra de madera u otras materias leñosas; incl. aglomeradas con resinas o demás ...",0,0,0,0,0,8209,4366,4772,3697,58,66,29,54,124,25,58,29,27,10,6
481099,"""Papel y cartón; estucados por una o las dos caras con caolín u otras sustancias inorgánicas; ...",250,332,208,312,3,4,7,3,7,0,15,22,2,0,10,2,1,3,5,6
520613,"""Hilados de algodón; con un alto contenido de algodón; pero < 85% en peso; sencillos; de fibras ...",228,129,0,0,16,19,0,0,0,0,7,62,9,99,29,2,40,62,5,6
620419,Trajes sastre; de materia textil; para mujeres o niñas (exc. de lana o pelo fino; de algodón ...,5,3,69,17,20,28,6,2,3,4,5,2,7,1,6,21,72,49,21,6
621030,Prendas de vestir del tipo descrito en la partida 6202; engomadas o impregnadas; revestidas; ...,46,98,41,90,96,40,74,17,33,19,10,21,37,10,1,2,0,17,38,6
720150,Fundición en bruto aleada y fundición especular; en lingotes; bloques o demás formas primarias,2,32,1,4,5,6,3,10,50,8,3,6,25,26,8,17,3,2,6,6
701890,"""Ojos de vidrio (exc. los de prótesis); objetos de cuentas de vidrio o de imitaciones de perlas; ...",1,0,9,13,20,7,41,9,5,32,18,7,13,35,134,171,178,116,102,6
701310,Artículos de vitrocerámica para servicio de mesa; de cocina; de tocador; para oficina; de adorno ...,40,78,4,2,17,105,43,78,29,57,24,224,15,29,9,13,12,7,4,6
551644,Tejidos con un alto contenido de fibras artificiales discontinuas; pero < 85% en peso; mezcladas ...,0,0,0,5,0,0,0,0,0,0,0,0,0,14,5,1,3,13,7,6
580133,Terciopelo y felpa por trama; cortados; de fibras sintéticas o artificiales (exc. los de punto ...,0,0,23,0,6,5,0,0,0,1,2,0,4,12,29,27,23,13,5,6
610719,Calzoncillos de punto; de materia textil; para hombres o niños (exc. de algodón o de fibras ...,12,23,20,59,52,173,355,144,534,64,48,74,54,35,5,4,7,6,98,6
581010,Bordados químicos o aéreos sobre materia textil y bordados con fondo recortado; en pieza; tiras ...,1,3,3,6,2,10,10,5,0,0,1,0,3,61,5,26,6,14,2,6
720925,Productos planos de hierro o acero sin alear; de anchura >= 600 mm; sin enrollar; simplemente ...,20,136,72,183,510,1287,100,87,400,213,5,154,19,13,104,27,4,8,3,6
871190,Motocicletas; incl. los ciclomotores; y velocípedos con motor auxiliar y sidecares para motocicletas ...,1,0,0,102,8,30,1,0,0,3,3,0,2,0,0,0,0,0,2,6
852713,Aparatos receptores de radiodifusión que pueden funcionar sin fuente de energía exterior; incl. ...,16,148,32,26,56,57,64,28,21,2,1,259,40,40,16,9,10,15,0,6
030233,"""Listados o bonitos de vientre rayado """"Euthynnus -Katsuwonus- pelamis""""; frescos o refrigerados""",0,0,0,0,0,0,0,0,0,0,0,0,0,0,0,95,666,238,7,6
030441,"""Filetes de salmones del Pacífico """"Oncorhynchus nerka""""; """"Oncorhynchus gorbuscha""""; """"Oncorhynchus ...",0,0,0,0,0,0,0,0,0,0,0,0,0,0,0,0,1,8,7,6
030363,"""Bacalao congelado """"Gadus morhua; Gadus ogac; Gadus macrocephalus""""""",0,0,0,0,0,0,0,0,0,0,0,0,0,54,0,0,1,97,6,6
030636,"""Camarones; incluso con cáscara o sin cáscara; vivos; frescos o refrigerados (excepto gambas ...",0,0,0,0,0,0,0,0,0,0,0,0,0,0,0,0,4,6,5,6
030614,Cangrejos congelados; incluso ahumado; incluso pelados o no; incl. Los cangrejos de caparazón; ...,1700,2398,1906,1870,1624,447,303,825,1890,1731,1711,632,564,449,985,871,69,772,15,6
071120,Aceitunas conservadas provisionalmente; p.ej.; con gas sulfuroso o con agua salada; sulfurosa ...,25,5,8,29,5,14,4,1,7,1,0,0,0,0,0,0,1,5,4,6
060420,Follaje; hojas; ramas y demás partes de plantas; sin flores ni capullos y hierbas; musgos y ...,0,0,0,0,0,0,0,0,0,0,38,0,0,0,3,9,0,0,1,6
030749,"""Sepia """"Sepia officinalis; Rossia macrosoma Sepiola spp."""" y el calamar """"Ommastrephes spp.; ...",805,60,291,698,66,53,15,44,7,0,1,0,0,0,0,0,2,4,5,6
040590,"""Grasas de la leche; así como mantequilla """"manteca"""" deshidratada y """"ghee"""" (exc. mantequilla ...",0,2454,1714,511,749,143,68,0,0,4297,814,2013,6475,0,0,520,22,3,5,6
382530,Desechos clínicos,0,0,0,0,0,0,0,0,0,0,0,0,0,0,0,0,0,0,1,5
120750,Semilla de mostaza; incl. quebrantada,0,14,0,3,2,0,3,4,0,0,0,0,0,0,0,11,6,3,4,5
160210,Carne; despojos; sangre o insectos preparados homogeneizados; acondicionados para la venta ...,7,6,88,81,10,22,69,44,108,117,7,0,0,0,29,1,1,4,4,5
160540,Crustáceos; preparados o conservados (excepto los ahumados; cangrejos; camarones; langostinos ...,32,39,451,707,584,0,0,0,0,0,15,0,0,0,0,0,1,4,7,5
170112,Azúcar de remolacha sólido; en bruto; sin adición de aromatizante ni colorante,0,0,0,0,0,0,0,0,0,0,0,6,15,12,7,0,1,5,7,5
