Código,Descripción del producto,Valor exportado en 2002,Valor exportado en 2003,Valor exportado en 2004,Valor exportado en 2005,Valor exportado en 2006,Valor exportado en 2007,Valor exportado en 2008,Valor exportado en 2009,Valor exportado en 2010,Valor exportado en 2011,Valor exportado en 2012,Valor exportado en 2013,Valor exportado en 2014,Valor exportado en 2015,Valor exportado en 2016,Valor exportado en 2017,Valor exportado en 2018,Valor exportado en 2019,Valor exportado en 2020,Valor exportado en 2021
250810,Bentonita,78,882,1315,1590,2455,4536,5222,6737,9129,9574,11102,9536,11367,12156,10477,9295,6361,6375,7465,6997
732190,Partes de los aparatos de calentamiento no eléctrico y de uso doméstico de la partida 7321; ...,12906,11325,16171,14680,20319,19230,18375,12706,13757,13121,9310,9188,4008,4554,3084,3049,4567,3116,3544,6977
080420,Higos; frescos o secos,1106,1673,2109,3573,4683,6587,7249,7798,7313,7302,8491,8212,8740,6941,6304,6627,6940,6671,4839,6956
701328,Vasos y demás recipientes de vidrio para beber (exc; de vitrocéramica o de cristal al plomo),0,0,0,0,0,12105,12555,9808,10863,7711,7566,4660,5214,5235,6336,6686,5988,5495,4641,6949
420221,"""Bolsos de mano """"carteras""""; incl. con bandolera o sin asas; con la superficie exterior de ...",2929,3876,5106,7066,6679,6897,7067,5511,6525,7144,6372,4903,6629,5136,6583,6332,4359,3779,3482,6937
841340,Bombas para hormigón,6581,8840,18235,29851,29567,25135,15514,1723,1274,1232,2574,2989,6517,13196,11168,13154,11302,10159,5534,6912
120510,"""Semillas de nabo """"nabina"""" o de colza con bajo contenido de ácido erúcico """"de las que se ...",0,0,240,572,0,6,0,0,0,0,39,0,0,0,4,0,567,729,554,6888
854690,Aisladores eléctricos (exc. de vidrio y de cerámica; así como las piezas aislantes),7174,8479,6932,8059,15134,21960,12880,11179,10275,7435,3165,2953,3621,3896,4750,6652,5538,8369,5868,6853
220600,Las demás bebidas fermentadas (por ejemplo: sidra; perada; aguamiel); mezclas de bebidas fermentadas ...,901,809,1404,1781,2529,3584,5250,4369,5857,5091,5617,5496,5292,3185,3118,3893,3463,5356,4365,6849
411410,Cueros y pieles agamuzados; incl. el agamuzado combinado al aceite (exc. cueros y pieles previamente ...,1056,2743,3740,4599,3727,1828,1909,1271,1721,4156,5340,4540,4436,4085,4526,4687,3152,4212,4096,6838
841960,Aparatos o dispositivos para licuefacción de aire u otros gases,4818,6054,2034,1681,1042,6671,7755,15480,1399,7161,2807,9479,1270,778,2353,657,1077,810,2541,6817
540419,Monofilamentos sintéticos de título >= 67 decitex y cuya mayor dimensión de la sección transversal ...,0,0,0,0,0,3309,3875,3026,4614,5080,3707,4335,3499,3664,4353,3733,4105,4134,4326,6808
841350,Bombas volumétricas alternativas; accionadas mecánicamente (exc. bombas de las subpartidas ...,373,474,890,1326,2126,3238,3969,2477,4938,10265,34747,28760,24029,6590,9977,14193,8959,8444,4583,6807
760521,Alambre de aleaciones de aluminio; cuya mayor dimensión de la sección transversal sea > 7 mm ...,2869,5683,7787,11287,18563,15348,14035,5429,11164,5533,2949,2187,2762,2209,1620,2043,3908,2090,3250,6797
841290,Partes de motores y de máquinas motrices; n.c.o.p.,1581,2511,2357,3665,6034,10401,15946,5686,122096,96241,4991,5719,7254,7112,5266,4709,6443,5705,4209,6757
381519,Catalizadores sobre soporte; n.c.o.p. (exc. con níquel o sus compuestos o con metal precioso ...,402,175,646,640,4097,177,292,580,520,240,225,2071,1006,579,1188,4519,8234,2833,3395,6755
841182,Turbinas de gas; de potencia > 5.000 kW (exc. turborreactores y turbopropulsores),26,5,1617,27653,0,3,12,12,322,7620,20,76,12,922,474,14947,16563,1901,17047,6734
290243,P-Xileno,1,1828,1318,0,39896,122633,148942,124666,165716,218447,224706,125611,26940,34493,23136,6641,26908,19979,0,6729
843210,Arados agrícolas; hortícolas o silvícolas,2438,3399,4466,3100,2668,6927,10080,5705,6625,8304,9225,7658,9900,6663,5468,5249,5373,4471,4075,6700
360500,Fósforos (cerillas) (excepto los artículos de pirotecnia de la partida 3604),4028,4788,4265,4690,4815,5150,6250,6154,6528,6939,7436,8254,7717,6351,7288,7346,6997,6964,7145,6698
481149,"""Papel y cartón; coloreados o decorados en la superficie o impresos; engomados o adhesivos ...",45,4,20,73,32,76,81,174,199,570,784,930,1730,2381,3371,3885,4325,3522,4300,6691
190219,Pastas alimenticias sin cocer; rellenar ni preparar de otra forma; que no contengan huevo,395,627,3123,2060,691,801,21056,11742,5678,7000,8490,15478,19941,1454,5567,5290,5254,4042,17212,6681
030323,"""Congelados de tilapia """"Oreochromis spp.""""""",0,0,0,0,0,0,0,0,0,0,0,0,0,0,0,0,45,166,1074,6680
210410,Preparaciones para sopas; potajes o caldos,4024,5667,3525,3812,5839,6466,6950,6358,7455,10967,5615,6196,6444,4530,8899,8864,6903,3333,5773,6678
844519,Máquinas para la preparación de materia textil (exc. cardas; peinadoras y mecheras),3443,6658,4887,3965,8516,7180,3457,1386,5433,9777,2831,1312,4037,1591,4464,5157,7781,4582,4871,6677
521149,"""Tejidos de algodón; con un alto contenido de algodón; pero < 85% en peso; mezclado exclusiva ...",445,788,905,536,678,440,370,432,1582,3926,8824,9574,11297,14604,12709,9162,6557,6855,4216,6668
901480,Instrumentos y aparatos para navegación (exc. los destinados para la navegación aérea o espacial; ...,3707,2096,3674,5055,1522,310,2537,1331,1331,1114,2267,1467,1194,1098,1637,2858,10649,17042,2838,6613
680690,Mezclas y manufacturas de materias minerales para aislamiento térmico o acústico o para la ...,1495,2888,3405,2615,4838,5056,5315,5818,6321,8347,9686,9611,8624,7553,7245,7610,8156,9149,6357,6603
200710,Confituras; jaleas y mermeladas; purés y pastas de frutas u otros frutos; obtenidos por cocción; ...,404,289,1368,1829,2294,2113,1462,864,361,2688,575,1668,1524,1870,1556,1978,3911,6210,7205,6578
741300,Cables; trenzas y artículos similares; de cobre; sin aislar para electricidad,207,233,1022,830,1149,1708,3422,2274,2529,3274,12120,21097,3997,5016,4982,4179,3980,4849,3513,6546
902129,Artículos y aparatos de prótesis dental (exc. dientes),15,173,149,1383,3038,4362,6659,4284,5859,4429,5395,6015,9507,8714,7119,5651,5621,5493,4177,6545
732399,De mesa; cocina o artículos de uso doméstico y sus partes; de hierro salvo el hierro fundido ...,507,777,694,1079,1092,939,1410,945,1100,1037,1080,1646,1300,1178,1502,1955,1813,1721,3551,6543
100620,"""Arroz descascarillado """"arroz cargo"""" o """"arroz pardo""""""",179,287,379,942,1021,503,11261,10694,8550,53812,33706,16489,2770,3462,3784,2697,2077,1238,5580,6534
820840,Cuchillas y hojas cortantes; de metal común; para máquinas agrícolas; hortícolas o forestales ...,284,586,1332,1180,1411,1308,2267,2452,2496,3006,3052,4427,3496,2964,3920,3957,3820,5448,5225,6531
281520,"""Hidróxido de potasio """"potasa cáustica""""""",1015,1208,2157,2833,4240,3723,9931,7733,8422,8099,11829,5435,10145,6370,6295,5406,5880,5156,7304,6518
854511,Electrodos de grafito u otros carbonos; de los tipos utilizados en hornos eléctricos,10753,12634,14507,15637,22686,33145,29620,8605,13385,17780,9540,7082,2239,464,2067,6461,8600,3664,3878,6471
830242,Guarniciones; herrajes y artículos simil.; de metal común; para muebles (exc. cerraduras; cerrojos ...,1075,1704,3877,4988,7539,9118,7133,4191,3987,3784,4823,4705,4970,5777,4269,5567,4950,4533,4279,6467
392113,Placas; láminas; hojas y tiras; de poliuretanos celulares; sin trabajar o trabajadas solo en ...,908,623,1389,800,1745,2257,3371,3049,3847,3446,3452,6032,3110,3458,3535,3754,2902,2374,1551,6456
200540,"""Guisantes """"arvejas; chícharos"""" """"Pisum sativum""""; preparados o conservados sin vinagre ni ...",1674,1824,1819,2019,1969,2776,3183,2572,3308,4280,4829,5622,4242,4125,4695,4483,21297,5811,6110,6441
480419,"""Papel y cartón para caras """"cubiertas"""" [""""kraftliner""""]; sin estucar ni recubrir; en bobinas ...",751,1774,2752,2346,1234,1060,1572,1166,990,442,295,154,1,63,3906,5427,7022,4453,4867,6435
843360,Máquinas para limpieza o clasificación de huevos; frutos o demás productos agrícolas (exc. ...,1541,1472,1708,2887,2963,5933,5999,4821,8743,9155,7759,7996,8709,12179,10925,7354,6325,4769,5151,6421
847710,Máquinas de moldear caucho o plástico por inyección (,3875,1942,4489,2775,2263,4616,1816,2814,4324,8121,5710,5344,6558,7614,10124,6383,7867,4001,4814,6400
380300,Tall oil; incluso refinado,1793,1402,1084,1907,1352,2016,1453,41,19,275,777,4761,2044,4391,7084,510,425,4604,5457,6388
190230,Pastas alimenticias cocidas o preparadas de otra forma (exc. las rellenas),269,373,953,963,541,773,941,866,1366,1273,1543,1204,1227,1149,1201,1661,2368,3141,4563,6365
290110,Hidrocarburos acíclicos saturados,1,0,5,1,0,85,37,713,3,66,19,214,1957,11843,1928,892,2009,3643,4563,6358
940510,Lámparas y demás aparatos eléctricos de alumbrado; para colgar o fijar al techo o a la pared ...,1123,1049,1360,2482,3601,4028,5356,4871,6840,9624,13965,10935,8806,9397,8406,7995,7385,7201,4425,6343
310420,Cloruro de potasio; para su utilización como abono (exc. en tabletas o formas simil. o en envases ...,309,597,983,878,1545,4775,11840,9312,9863,8638,7546,17450,11219,10378,5757,4072,3066,1966,7056,6335
854130,Tiristores; diacs y triacs (exc. dispositivos de material semiconductor fotosensibles),1694,881,1174,2242,5625,12767,20075,6990,10244,16220,9078,9169,10050,7763,6618,7922,10487,7424,6065,6334
292910,Isocianatos,30727,21761,21108,14598,10696,18840,19651,14280,14189,11532,8493,3564,1874,906,1361,1230,2640,1371,1142,6333
310100,Abonos de origen animal o vegetal; incluso mezclados entre sí o tratados químicamente; abonos ...,576,1350,1756,1327,1215,1514,1637,1360,3112,5860,9252,7581,7074,5306,4419,6739,7414,5685,5057,6315
600632,"""Tejidos de punto; de anchura > 30 cm; de fibras sintéticas; teñidos (exc. tejidos de punto ...",2303,3847,6826,8123,10641,11060,11965,4473,5575,5410,4291,3469,5199,5346,4108,5555,4252,5485,3653,6282
722211,Barras de acero inoxidable; simplemente laminadas o extrudidas en caliente; de sección circular,246,383,44,156,395,641,2427,521,4159,7614,9793,9644,7765,9297,8162,8131,7148,8012,3192,6275
401035,"""Correas de transmisión; sin fin; con muescas """"sincrónicas""""; de circunferencia exterior > ...",897,2046,4016,4324,4317,4574,6086,5662,4067,3407,2925,3576,2730,4781,7089,8468,6558,4902,4155,6268
740729,"""Barras y perfiles; de aleaciones de cobre; n.c.o.p. (exc. de aleaciones a base de cobre-cinc ...",679,1168,4192,2195,4140,4770,3056,909,2614,2770,3222,4259,4680,3387,2692,5777,5004,6290,3331,6257
845019,Máquinas para lavar ropa; de capacidad unitaria; expresada en peso de ropa seca <= 6 kg (exc. ...,1359,1766,2611,3078,3450,5125,7666,6255,7680,9553,6596,8078,6712,6533,6096,6879,12891,5165,3465,6219
050790,"""Concha """"caparazón"""" de tortuga; ballenas de mamíferos marinos; incl. las barbas; cuernos; ...",2104,3031,2944,2077,2900,2977,3352,3374,3210,2870,2934,2641,4127,3826,4682,4119,3552,3755,5600,6213
700232,Tubos de vidrio; con un coeficiente de dilatación lineal <= 5 x 10-6 por Kelvin; entre 0°C ...,1,0,2,0,13,8,2949,6998,8190,8859,9346,9594,8419,8183,9324,9948,9774,5521,8167,6195
760421,Perfiles huecos; de aleaciones de aluminio; n.c.o.p.,4691,4251,6149,9348,12367,8912,7418,4296,5664,6180,5134,4739,4729,3716,3643,4412,4360,5119,5536,6181
731822,"""Arandelas; de fundición; hierro o acero (exc. de muelle """"resorte"""" y las demás de seguridad)""",1378,1746,2248,3075,3708,5661,7254,5023,6798,8237,7295,6960,6237,5273,4547,5927,6833,10217,7924,6119
701337,Vasos; jarros y demás recipientes de cristal para beber (exc. de vitrocéramica),0,0,0,0,0,13232,16430,11893,13161,11569,9723,7481,7995,7670,7408,9123,7259,5586,4186,6102
440290,Carbón vegetal; incluso aglomerado (exc. ​​de bambú o de cáscara o nuez; carbón vegetal utilizado ...,0,0,0,0,0,2940,1609,2200,1116,560,457,692,742,1650,1563,1859,2064,6306,7064,6101
732619,Manufacturas de hierro o acero; forjadas o estampadas pero sin trabajar de otro modo; n.c.o.p. ...,31540,29899,50463,47786,55891,51083,67117,25430,42690,32836,44101,30853,19134,19043,15027,10813,6757,7118,5827,6092
854520,Escobillas de carbón; para usos eléctricos,5354,5269,5836,5214,5413,6342,6885,3597,4631,5482,5343,5694,5570,5597,5242,4850,4988,4777,4884,6091
721320,"""Alambrón de acero de fácil mecanización; sin alear; enrollado en espiras irregulares """"coronas"""" ...",3,0,4,1,50,1,3,4,12,4,5,26,61,1821,3633,5835,4253,6455,3398,6088
390750,Resinas alcídicas; en formas primarias,404,511,709,3433,2295,902,1568,861,1263,1276,1060,1436,1574,2191,2329,2875,3813,3385,4186,6052
390890,Poliamidas; en formas primarias (exc. poliamidas-6; -11; -12; -6;6; -6;9; -6;10; ó -6;12),1635,1987,2135,3033,3161,2386,2689,3309,3031,2046,2913,2704,3229,3340,2894,2334,2404,3194,4153,6038
470100,Pasta mecánica de madera,152,200,84,0,0,63,0,0,0,21,7,22,36,0,0,64,73,116,337,6037
845230,Agujas para máquinas de,2316,1655,2452,2987,2795,3533,3985,4072,5021,6552,6764,7356,5908,5068,4762,5565,5442,5791,6026,6030
842010,Calandrias y laminadores (exc. metal o vidrio),338,1143,4032,4613,8105,6314,6798,2888,2807,4840,2591,5031,3350,3687,5236,8099,3003,5007,4627,6012
481092,"""Papel y cartón multicapas; estucados por una o las dos caras con caolín u otras sustancias ...",40523,62599,49694,64025,71465,83744,129795,124452,130451,171371,150905,104716,90629,102683,86014,74321,38146,45603,41121,5997
842121,Aparatos de filtrar o depurar agua,2536,3559,7317,14680,18870,14305,18513,10201,27507,31112,38562,6670,46254,59225,41794,37133,12712,13815,33272,5990
381220,Plastificantes compuestos para caucho o plástico; n.c.o.p.,28,144,99,72,84,106,77,810,1801,2369,1652,5357,5453,3887,4046,3927,4132,2766,2668,5963
330620,"""Hilo utilizado para limpieza de los espacios interdentales """"hilo dental""""; en envases individuales ...",2778,3169,4304,5586,6442,6938,7866,6818,7980,13185,11180,8468,8319,7711,5452,5535,5317,4400,4113,5962
820559,Herramientas de mano; incl. los diamantes de vidriero; de metal común; n.c.o.p.,3121,3205,5659,5715,4790,7116,7491,5176,6415,7278,7768,8211,7446,14434,6623,7077,6910,7313,5882,5955
820411,Llaves de ajuste de mano; incl. las llaves dinamométricas; de metal común; de boca fija,1124,1557,2807,3611,4393,5212,7010,4552,6554,8015,7436,7318,6455,5443,4851,5853,5116,5283,3959,5937
680100,Adoquines; encintado (bordillos) y losas para pavimentos; de piedra natural (excepto la pizarra),13636,16428,23210,27213,32758,40280,35876,27657,29835,34019,23948,13763,14077,11321,9657,7535,6084,5607,5321,5928
846610,Portaútiles para máquinas herramienta y para herramientas de mano de cualquier tipo; dispositivos ...,1450,1825,1922,3452,3818,4319,5873,5205,6464,6570,5769,6106,8761,6039,6696,6601,7143,8656,6072,5924
702000,Las demás manufacturas de vidrio,272,1387,3337,454,369,327,3748,5630,5902,5535,6092,6021,7591,6652,6526,6816,4366,4936,5478,5924
391110,Resinas de petróleo; resinas de cumarona; resinas de indeno; resinas de cumarona-indeno y politerpenos; ...,3960,4883,5321,6751,6646,7026,6718,6366,6607,8250,10793,9404,5656,7108,6955,6723,7674,7279,6344,5919
720229,Ferrosilicio; con un contenido de silicio <= 55% en peso,20043,16854,21113,14127,15136,19815,39135,20705,30557,40325,18894,23596,10261,437,282,576,5188,1786,2039,5919
400211,"""Látex de caucho estireno-butadieno """"SBR"""" o de caucho estireno- butadieno carboxilado """"XSBR""""""",4844,6957,7283,11644,17989,16896,10031,8764,8440,17265,14339,8488,4487,3576,5547,10216,10204,7229,3778,5901
720826,Productos planos de hierro o acero sin alear; de anchura >= 600 mm; enrollados; simplemente ...,18713,17197,20125,18623,24783,25952,20406,8370,17188,19773,11329,6798,6295,18041,10856,7468,6261,5846,5084,5899
820299,Hojas de sierra; incl. las hojas sin dentar; de metal común (exc. hojas de sierra de cinta; ...,459,376,811,1042,879,1397,1618,924,1451,1651,1235,1124,1651,1017,1010,1426,1524,1888,1865,5876
071420,"""Batatas """"boniatos; camotes""""; frescas; refrigeradas; congeladas o secas; incl. troceadas ...",405,432,567,694,1517,1465,2048,2128,1969,1902,1813,2188,2283,1475,7288,2697,3694,4533,6234,5862
400932,"""Tubos de caucho vulcanizado sin endurecer; reforzados o combinados de otro modo solamente ...",401,10688,11937,15065,14615,18405,12628,13994,20924,14865,17609,13749,12536,9242,6896,7036,7497,5072,3615,5843
847790,Partes de máquinas y de aparatos de trabajar caucho o plástico o para fabricar productos de ...,5155,5195,5135,9059,6610,7834,7239,6006,6759,39056,18424,8366,5136,5271,7274,6001,4422,4975,3530,5840
902519,Termómetros y pirómetros; sin combinar con otros instrumentos (exc. termómetros de líquido ...,751,993,1899,1844,1600,2041,2297,1248,1540,1737,1196,1200,1498,1441,1443,1005,1173,1345,2389,5834
590210,Napas tramadas para neumáticos fabricadas con hilados de alta tenacidad de nailon o demás poliamidas; ...,5839,8348,17169,26692,20250,14925,10143,16548,23867,37966,35616,19802,15268,8017,6773,6546,5277,7831,3383,5825
722511,"""Productos laminados planos de acero al silicio llam. """"magnético"""" """"acero magnético al silicio""""; ...",1013,2480,7235,6461,20479,29400,46886,56260,12148,8756,12648,6655,13712,15772,8106,5127,11143,15602,12425,5819
540245,Hilados de filamentos de nailon o demás poliamidas; incl. los monofilamentos de título < 67 ...,0,0,0,0,0,9391,8752,8666,9897,10706,13974,12288,10599,6278,5555,4145,2850,5667,4752,5818
847720,Extrusoras; para trabajar caucho o plástico,6666,14388,9933,17588,17881,13482,19281,13159,11149,10651,23400,13898,14770,10310,16920,15058,7240,9893,12819,5794
290531,"""Etilenglicol """"etanodiol""""""",30246,64121,68298,52558,48570,74714,51300,12813,14594,5643,12947,6237,3712,2718,4095,2379,1391,541,692,5793
902690,Partes y accesorios de instrumentos y aparatos para medida o control del caudal; nivel; presión ...,1794,2847,3659,3811,5840,5670,5763,4557,6609,7999,6699,5942,6314,7167,5922,6886,5725,7041,5953,5792
730792,Codos; curvas y manguitos de tubería; de hierro o acero; roscados (exc. moldeados o de acero ...,313,700,809,1636,703,739,813,2145,949,1441,1261,4609,3192,2017,2306,2648,4635,12615,5252,5791
851680,Resistencias calentadoras; eléctricas (exc. de carbón aglomerado o de grafito),963,809,976,1354,1951,2564,2820,3044,4903,4183,4649,4635,4973,5672,4218,4941,6142,4449,5228,5786
230320,Pulpa de remolacha; bagazo de caña de azúcar y demás desperdicios de la industria azucarera,60,51,28,135,7,19,7,45,25,29,44,97,318,13,39,26,1726,0,7450,5785
843820,Máquinas y aparatos; de tipo industrial; para confitería; elaboración de cacao o la fabricación ...,767,1409,1505,1511,2731,1776,3154,3709,1996,1384,1390,1691,2259,2720,2316,3650,3355,3655,2626,5780
400931,Tubos de caucho vulcanizado sin endurecer; reforzados o combinados de otro modo solamente con ...,3691,5501,6026,7953,7614,7990,8365,5933,9548,10729,9959,8204,6493,5784,4639,5865,5776,4830,3741,5744
290543,Manitol,5463,7751,6335,6282,5928,7748,10442,12008,8242,9613,9600,9399,8315,8048,7059,7948,8656,7344,6493,5738
760820,Tubos de aleaciones de aluminio (exc. perfiles huecos),1817,4378,8078,10636,6781,8200,7926,6642,10154,13865,9193,8184,6111,6219,4632,5294,5100,3613,3116,5722
721250,Productos planos de hierro o acero sin alear; de anchura < 600 mm; laminados en frío o en caliente; ...,113,167,155,17,324,884,1670,1126,2459,4952,3696,1911,1434,2174,1984,3181,3702,4163,3615,5694
841199,Partes de turborreactores o de turbopropulsores; n.c.o.p.,610,602,1767,3255,2626,8301,1276,794,1627,5244,2402,2043,2540,2364,5491,11070,4973,15327,4895,5677
940180,Asientos; n.c.o.p.,857,958,1533,1846,2473,2767,3889,3225,3445,4267,3119,3623,3867,3442,3413,4257,6851,6444,4395,5670
080261,Nueces de macadamia; frescas o secas; con cáscara,0,0,0,0,0,0,0,0,0,0,704,933,2570,875,841,3638,4788,6690,8393,5668
720853,Productos planos de hierro o acero sin alear; de anchura >= 600 mm; no enrollados; simplemente ...,2706,4122,5635,3896,7182,8334,8917,9192,6558,2787,4579,1403,612,1377,1142,1007,905,838,2671,5656
843229,"""Gradas """"rastras""""; escarificadores; cultivadores; estirpadores; azadas; rotativas """"rotocultores""""; ...",333,418,1028,904,1061,2788,3281,2646,4081,5474,7105,4408,4084,3907,2377,4188,3358,6542,2755,5647
844180,Máquinas y aparatos para el trabajo de la pasta de papel; del papel o cartón; n.c.o.p.,20694,27496,26060,37376,41093,49190,33525,16604,18926,14496,10143,9111,10835,9367,10829,7053,6686,1952,2193,5631
732090,"""Muelles """"resortes"""" y sus hojas; de hierro o acero; incl. los resortes espirales planos (exc. ...",6134,7622,8870,16853,22853,25436,27024,13936,13620,15267,18876,16899,12842,10817,9353,8032,6181,5208,3876,5628
820520,Martillos y mazas; con parte operante de metal común,3660,3158,4144,5333,4781,5170,6362,4062,5184,5726,5354,5205,5597,4773,4058,3803,4017,4012,3208,5622
292122,Hexametilendiamina y sus sales,10,0,52,0,0,0,66,84,398,8302,675,1802,955,210,454,258,1216,3074,5597,5621
481151,"""Papel y cartón; coloreados o decorados en la superficie o impresos; recubiertos; impregnados ...",1191,1096,1167,1837,1694,1357,1740,1502,9185,3842,6645,5738,6536,5208,3460,3775,4019,6453,3904,5616
320210,Productos curtientes orgánicos sintéticos,2499,2331,3093,3566,3864,3928,4283,4124,5579,4425,4651,4061,5479,5361,5831,4891,5137,5071,3935,5606
844832,Partes y accesorios de máquinas para la preparación de materia textil; n.c.o.p. (exc. guarniciones ...,4436,5339,5300,4482,4577,8330,2604,988,1581,864,2351,3464,3332,3390,4199,7426,7872,3198,4062,5594
850431,Transformadores de tipo seco de potencia <= 1 kVA,4578,3830,3901,4181,6022,4783,4750,5187,5322,5924,6657,5214,6995,8240,4020,5064,5756,5995,5242,5593
391239,Éteres de celulosa; en formas primarias (exc. carboximetilcelulosa y sus sales),5081,8253,6254,9105,5979,12768,2845,213,287,215,173,742,1058,450,482,539,1419,2358,3081,5583
441990,Vajilla y utensilios de cocina; de madera (exc. bambú o madera tropical; y adornos de interior; ...,0,0,0,0,0,0,0,0,0,0,0,0,0,0,0,1943,2954,2177,2278,5580
030617,Camarones y langostinos congelados; incluso ahumado; incluso pelados o no; incl. camarones ...,0,0,0,0,0,0,0,0,0,0,6875,10447,8488,7305,7179,2986,2813,3107,2272,5578
961700,Termos y demás recipientes isotérmicos; montados y aislados por vacío; así como sus partes ...,4468,4422,5733,6502,6390,7055,6707,14866,6332,7646,7009,5682,6280,5170,5019,6433,7239,6093,4848,5552
846410,Máquinas de aserrar para trabajar piedra; cerámica; hormigón; amiantocemento o materias minerales ...,116,142,45,72,83,23,285,315,245,916,127,739,1399,607,918,1107,2440,1097,2495,5542
411390,Cueros preparados después del curtido o del secado y cueros y pieles apergaminados; de antílopes; ...,0,575,540,828,2177,4,63,50,19,35,508,367,960,1842,1975,2276,3197,3630,3647,5531
480890,"""Papel y cartón; rizados [""""crepés""""]; plisados; gofrados; estampados o perforados; en bobinas ...",950,577,491,449,509,470,335,347,360,221,102,468,744,1083,4786,8005,6996,5973,7052,5529
830160,Partes de candados; de cerraduras y de cerrojos; así como de cierres y de monturas cierre; ...,5084,8186,10023,10023,14160,18705,21638,17478,19967,21512,24829,22023,15740,12955,8649,6629,4240,3577,3400,5527
300450,"""Medicamentos; que contengan provitaminas; vitaminas; incl. los concentrados naturales; o sus ...",5517,6504,9158,13950,25547,27199,35594,34068,17699,24452,36010,27498,19663,11982,5521,3536,2759,3292,4056,5526
382000,Preparaciones anticongelantes y líquidos preparados para descongelar,4037,1680,6186,8551,3987,2931,4365,3417,8014,37245,32607,24939,10753,5141,4563,5240,4600,4902,3785,5512
841231,"""Motores neumáticos; con movimiento rectilíneo """"cilindros""""""",637,661,1333,2576,2760,3706,3485,2494,3368,4263,4088,3841,3765,3624,3294,4203,5110,6022,4263,5508
380290,Kieselguhr activado y demás materias minerales naturales activadas; negro de origen animal; ...,1310,1481,1700,1983,2302,2425,1632,1738,1346,1796,2378,1823,3985,6987,6597,5184,5261,5222,2169,5499
292690,"""Compuestos con función nitrilo (exc. acrilonitrilo; 1-cianoguanidina """"diciandiamida""""; fenproporex ...",9229,2061,2011,5202,2335,12122,4319,1645,1037,5515,63372,68798,32760,3324,832,2012,4325,9779,3647,5497
282550,Óxidos e hidróxidos de cobre,104,192,220,129,109,288,98,540,234,580,2278,653,1363,1675,9806,5222,3417,4884,2650,5475
844250,Caracteres de imprenta; clisés; planchas; cilindros y demás elementos impresores; piedras litográficas; ...,2030,2915,2682,3124,4090,4603,3661,3214,5298,5632,6704,6547,4714,5505,4826,6119,5080,4454,4223,5469
340120,Jabón en copos; en gránulos; en polvo; en pasta o en disolución acuosa,1761,2209,3404,5284,2588,3127,4215,8139,4266,10354,11757,9152,19607,16037,5641,1955,962,1611,1598,5468
750110,Matas de níquel,31389,36766,65350,71100,94002,169762,106295,63958,193748,247450,184732,157701,1404,0,0,0,0,0,250,5468
401031,Correas de transmisión; sin fin; estriadas; de sección trapezoidal; de circunferencia exterior ...,957,1288,1627,1591,2141,2396,5109,2610,3326,4912,4928,4327,3682,4728,6159,5475,5184,4573,3855,5452
292211,Monoetanolamina y sus sales,616,884,1639,1125,1628,1413,2719,4611,2656,3112,1567,1447,751,672,618,631,301,130,251,5444
030431,"""Filetes frescos o refrigerados de tilapia """"Oreochromis spp.""""""",0,0,0,0,0,0,0,0,0,0,80,506,421,1042,6371,4448,3414,4866,5260,5437
846024,Rectificadoras para el acabado de metal; de control numérico (exc. De la superficie plana; ...,0,0,0,0,0,0,0,0,0,0,0,0,0,0,0,2459,3021,3991,3936,5434
848240,Rodamientos de agujas,2053,2019,2982,3788,4101,4651,4900,5912,6551,7163,7194,6373,6509,5061,4096,5560,11109,8143,4597,5434
520299,Desperdicios de algodón (exc. desperdicios de hilados e hilachas),500,396,598,698,1409,3575,5033,5600,306,255,892,492,440,221,478,601,232,448,7403,5426
842620,Grúas de torre,9,0,364,246,323,1073,851,37,242,42,6192,8331,13863,5458,14127,740,4199,8595,2080,5413
300410,"""Medicamentos; que contengan estreptomicinas o derivados de estos productos; incl. en compuestos ...",5588,2535,3815,4255,6866,4390,1546,2159,1439,1686,2218,2583,2419,2151,2070,1965,2340,3120,4338,5407
